{
  "$schema": "https://json-schema.org/draft/2020-12/schema",
  "$id": "https://bike-trip.local/schema/trip.json",
  "title": "Trip",
  "description": "One motorcycle trip: the days, the base camps you sleep at, the campsites, and the pre-departure checklist. The whole plan is this one document. Give it to a model and ask for another trip in the same shape.",
  "type": "object",
  "required": ["schemaVersion", "slug", "name", "bounds", "bases", "days"],
  "additionalProperties": false,
  "properties": {
    "schemaVersion": {
      "type": "integer",
      "const": 1,
      "description": "Document version. Always 1 today."
    },
    "slug": {
      "type": "string",
      "pattern": "^[a-z0-9]+(?:-[a-z0-9]+)*$",
      "description": "Short lowercase identifier, unique across trips. Example: \"provence\".",
      "examples": ["provence", "pyrenees-2027"]
    },
    "name": {
      "type": "string",
      "minLength": 1,
      "description": "Display name. Short — it sits in a tab.",
      "examples": ["Alpes Maritimes"]
    },
    "subtitle": {
      "type": "string",
      "description": "The region in plain words, shown above the name.",
      "examples": ["Provence & the Riviera"]
    },
    "origin": {
      "type": "string",
      "description": "Where the trip starts from.",
      "examples": ["Bremen"]
    },
    "dates": {
      "type": "string",
      "description": "Human-readable date range. Not parsed.",
      "examples": ["7–17 September 2026"]
    },

    "bounds": {
      "type": "object",
      "description": "The map window the trip opens at. Stops well outside it are flagged as a likely swapped lat/lon.",
      "required": ["lat0", "lat1", "lon0", "lon1"],
      "additionalProperties": false,
      "properties": {
        "lat0": { "type": "number", "minimum": -90, "maximum": 90, "description": "Southern edge." },
        "lat1": { "type": "number", "minimum": -90, "maximum": 90, "description": "Northern edge. Must be greater than lat0." },
        "lon0": { "type": "number", "minimum": -180, "maximum": 180, "description": "Western edge." },
        "lon1": { "type": "number", "minimum": -180, "maximum": 180, "description": "Eastern edge. Must be greater than lon0." }
      }
    },

    "vanIn": {
      "type": "number",
      "minimum": 0,
      "description": "Kilometres the van drives from home to the first base."
    },
    "vanOut": {
      "type": "number",
      "minimum": 0,
      "description": "Kilometres the van drives home from the last base."
    },

    "bases": {
      "type": "array",
      "description": "Camps you sleep at for several nights and ride out from.",
      "items": {
        "type": "object",
        "required": ["index", "name", "lat", "lon", "arriveDay"],
        "additionalProperties": false,
        "properties": {
          "index": { "type": "integer", "minimum": 1, "description": "1, 2, 3 … in the order you reach them. Unique." },
          "name": { "type": "string", "minLength": 1 },
          "lat": { "type": "number", "minimum": -90, "maximum": 90 },
          "lon": { "type": "number", "minimum": -180, "maximum": 180 },
          "arriveDay": { "type": "integer", "minimum": 1, "description": "The day you pitch here. Must be a day that exists." },
          "nights": { "type": "string", "examples": ["nights 1–3"] }
        }
      }
    },

    "days": {
      "type": "array",
      "minItems": 1,
      "description": "Every day of the trip. Day numbers must run 1..N with no gaps.",
      "items": {
        "type": "object",
        "required": ["n", "type", "title"],
        "additionalProperties": false,
        "properties": {
          "n": { "type": "integer", "minimum": 1, "description": "Day number. Unique, contiguous from 1." },
          "date": { "type": "string", "examples": ["Fri 11 Sep"] },
          "type": {
            "enum": ["ride", "van"],
            "description": "\"ride\" is a day out from a base; \"van\" is a day the transporter moves."
          },
          "title": { "type": "string", "minLength": 1 },
          "base": { "type": "string", "description": "Where you sleep, as written on the roadbook.", "examples": ["Base 2 · Castellane"] },
          "detail": { "type": "string", "description": "What the day is actually like, and anything that will bite you." },
          "km": { "type": "number", "minimum": 0, "description": "Planned riding kilometres. 0 on a pure transfer day." },
          "van": { "type": "number", "minimum": 0, "description": "Van transfer kilometres. 0 on a riding day." },
          "hours": { "type": "number", "minimum": 0, "description": "Planned saddle or driving time." },
          "stops": {
            "type": "array",
            "description": "Places the day passes through, in riding order. Two or more to be routable; leave empty for a pure transfer with no stops. A loop day repeats its base at the start and end.",
            "items": {
              "type": "object",
              "required": ["name", "lat", "lon"],
              "additionalProperties": false,
              "properties": {
                "name": { "type": "string", "minLength": 1 },
                "lat": { "type": "number", "minimum": -90, "maximum": 90, "description": "Latitude. For France this is roughly 42–51." },
                "lon": { "type": "number", "minimum": -180, "maximum": 180, "description": "Longitude. For France this is roughly -5 to 8." }
              }
            }
          }
        }
      }
    },

    "campsites": {
      "type": "array",
      "description": "One entry per base. Use status \"not-researched\" for a base with nothing chosen yet rather than leaving it out — an open task is more useful than a gap.",
      "items": {
        "type": "object",
        "required": ["base", "status", "closingDateVerified"],
        "additionalProperties": false,
        "properties": {
          "base": { "type": "integer", "minimum": 1, "description": "The base index this campsite serves." },
          "baseName": { "type": "string", "description": "Filled in by the server from the base list." },
          "status": { "enum": ["picked", "not-researched"] },
          "name": { "type": "string", "description": "Required when status is \"picked\"." },
          "rating": { "type": "number", "minimum": 0, "maximum": 5 },
          "reviews": { "type": "integer", "minimum": 0 },
          "phone": { "type": "string", "examples": ["+33 4 93 04 10 48"] },
          "lat": { "type": "number", "minimum": -90, "maximum": 90 },
          "lon": { "type": "number", "minimum": -180, "maximum": 180 },
          "coordsApprox": { "type": "boolean", "description": "True when lat/lon are the base town rather than the pitch." },
          "note": { "type": "string" },
          "closingDateVerified": { "type": "boolean", "description": "Whether someone has actually confirmed the site is open on your dates." }
        }
      }
    },
    "rejectedCampsites": {
      "type": "array",
      "items": { "type": "string" },
      "description": "Sites looked at and turned down, with the reason, so nobody researches the same ground twice.",
      "examples": [["Les Cigales — dated, stony ground"]]
    },
    "campsiteCaveat": {
      "type": "string",
      "description": "Standing warning shown above the campsite list."
    },

    "kit": {
      "type": "array",
      "description": "Pre-departure checklist, grouped. Put anything legally required in a group with legal: true.",
      "items": {
        "type": "object",
        "required": ["group", "items"],
        "additionalProperties": false,
        "properties": {
          "group": { "type": "string", "minLength": 1 },
          "legal": { "type": "boolean", "description": "Items here carry a fine, not an inconvenience." },
          "items": {
            "type": "array",
            "items": {
              "type": "object",
              "required": ["id", "title"],
              "additionalProperties": false,
              "properties": {
                "id": {
                  "type": "string",
                  "minLength": 1,
                  "description": "Stable identifier, unique across the whole checklist. Tick state is keyed by it — reusing an id from a previous version keeps its tick, renaming one loses it.",
                  "examples": ["law-gloves", "camp-closing"]
                },
                "title": { "type": "string", "minLength": 1 },
                "why": { "type": "string", "description": "Why it matters. Concrete beats stern." },
                "flag": { "type": "string", "description": "A fine or an open question.", "examples": ["€135", "CHECK", "NEEDED"] }
              }
            }
          }
        }
      }
    }
  }
}
