{
  "schemaVersion": 1,
  "slug": "provence",
  "name": "Alpes Maritimes",
  "subtitle": "Provence & the Riviera",
  "origin": "Bremen",
  "dates": "7–17 September 2026",
  "bounds": {
    "lat0": 43,
    "lat1": 44.4,
    "lon0": 4.9,
    "lon1": 7.8
  },
  "vanIn": 1450,
  "vanOut": 1250,
  "bases": [
    {
      "index": 1,
      "name": "Sospel",
      "lat": 43.876,
      "lon": 7.448,
      "arriveDay": 1,
      "nights": "nights 1–3"
    },
    {
      "index": 2,
      "name": "Castellane",
      "lat": 43.847,
      "lon": 6.513,
      "arriveDay": 4,
      "nights": "nights 4–6"
    },
    {
      "index": 3,
      "name": "Cassis",
      "lat": 43.215,
      "lon": 5.539,
      "arriveDay": 7,
      "nights": "nights 7–8"
    },
    {
      "index": 4,
      "name": "Luberon",
      "lat": 43.823,
      "lon": 5.308,
      "arriveDay": 9,
      "nights": "nights 9–10"
    }
  ],
  "days": [
    {
      "n": 1,
      "date": "Mon 7 Sep",
      "type": "van",
      "title": "Bremen → Sospel",
      "base": "Base 1 · Sospel · nights 1–3",
      "detail": "The big one. ~1 450 km via Basel, Bern and the Rhône valley — two drivers, 05:00 start, camp by dusk. If that sounds brutal, break it near Beaune and arrive midday on the 8th; you lose half a riding day but nobody arrives wrecked.",
      "km": 0,
      "van": 1450,
      "hours": 0,
      "stops": []
    },
    {
      "n": 2,
      "date": "Tue 8 Sep",
      "type": "ride",
      "title": "Col de Turini",
      "base": "Base 1 · Sospel",
      "detail": "The Monte Carlo Rally stage — 34 hairpins up from Sospel. Then Peïra-Cava, Col Saint-Roch, the hill village of Lucéram, home over Col de Braus. Short distance, enormous amount of cornering.",
      "km": 230,
      "van": 0,
      "hours": 5,
      "stops": [
        {
          "name": "Sospel",
          "lat": 43.876,
          "lon": 7.448
        },
        {
          "name": "Col de Turini",
          "lat": 44,
          "lon": 7.38
        },
        {
          "name": "Peïra-Cava",
          "lat": 43.955,
          "lon": 7.354
        },
        {
          "name": "Col Saint-Roch",
          "lat": 43.923,
          "lon": 7.343
        },
        {
          "name": "Lucéram",
          "lat": 43.884,
          "lon": 7.361
        },
        {
          "name": "Col de Braus",
          "lat": 43.877,
          "lon": 7.398
        },
        {
          "name": "Sospel",
          "lat": 43.876,
          "lon": 7.448
        }
      ]
    },
    {
      "n": 3,
      "date": "Wed 9 Sep",
      "type": "ride",
      "title": "Gorges du Loup & the Corniches",
      "base": "Base 1 · Sospel",
      "detail": "West to Col de Vence and the cliff village of Gourdon, down the Gorges du Loup, then back east along the three Corniches above Monaco. Ride the Corniches late — the light is better and the traffic has gone.",
      "km": 250,
      "van": 0,
      "hours": 5.5,
      "stops": [
        {
          "name": "Sospel",
          "lat": 43.876,
          "lon": 7.448
        },
        {
          "name": "Nice",
          "lat": 43.7,
          "lon": 7.27
        },
        {
          "name": "Vence",
          "lat": 43.723,
          "lon": 7.112
        },
        {
          "name": "Col de Vence",
          "lat": 43.76,
          "lon": 7.077
        },
        {
          "name": "Gourdon",
          "lat": 43.72,
          "lon": 6.978
        },
        {
          "name": "Gorges du Loup",
          "lat": 43.752,
          "lon": 6.985
        },
        {
          "name": "Grasse",
          "lat": 43.658,
          "lon": 6.925
        },
        {
          "name": "Èze",
          "lat": 43.727,
          "lon": 7.362
        },
        {
          "name": "Monaco",
          "lat": 43.738,
          "lon": 7.424
        },
        {
          "name": "Sospel",
          "lat": 43.876,
          "lon": 7.448
        }
      ]
    },
    {
      "n": 4,
      "date": "Thu 10 Sep",
      "type": "van",
      "title": "Sospel → Castellane",
      "base": "Base 2 · Castellane · nights 4–6",
      "detail": "Strike camp, ~150 km inland via Grasse. Pitch by early afternoon, then a shakeout run north on the Route Napoléon.",
      "km": 120,
      "van": 150,
      "hours": 2.5,
      "stops": [
        {
          "name": "Castellane",
          "lat": 43.847,
          "lon": 6.513
        },
        {
          "name": "Senez",
          "lat": 43.909,
          "lon": 6.397
        },
        {
          "name": "Barrême",
          "lat": 43.951,
          "lon": 6.368
        },
        {
          "name": "Castellane",
          "lat": 43.847,
          "lon": 6.513
        }
      ]
    },
    {
      "n": 5,
      "date": "Fri 11 Sep",
      "type": "ride",
      "title": "Gorges du Verdon circuit",
      "base": "Base 2 · Castellane",
      "detail": "The Route des Crêtes (D23) is one-way and rides clockwise — do it first, early. Then the Corniche Sublime along the south rim, around Lac de Sainte-Croix and back via Moustiers. Slow going: you will stop constantly.",
      "km": 230,
      "van": 0,
      "hours": 5.5,
      "stops": [
        {
          "name": "Castellane",
          "lat": 43.847,
          "lon": 6.513
        },
        {
          "name": "Point Sublime",
          "lat": 43.797,
          "lon": 6.4
        },
        {
          "name": "La Palud-sur-Verdon",
          "lat": 43.783,
          "lon": 6.343
        },
        {
          "name": "Moustiers",
          "lat": 43.846,
          "lon": 6.222
        },
        {
          "name": "Lac de Sainte-Croix",
          "lat": 43.76,
          "lon": 6.213
        },
        {
          "name": "Aiguines",
          "lat": 43.769,
          "lon": 6.23
        },
        {
          "name": "Corniche Sublime",
          "lat": 43.75,
          "lon": 6.29
        },
        {
          "name": "Comps-sur-Artuby",
          "lat": 43.706,
          "lon": 6.51
        },
        {
          "name": "Castellane",
          "lat": 43.847,
          "lon": 6.513
        }
      ]
    },
    {
      "n": 6,
      "date": "Sat 12 Sep",
      "type": "ride",
      "title": "Gorges du Cians & Daluis",
      "base": "Base 2 · Castellane",
      "detail": "North-east via Entrevaux into the red-rock gorges — Daluis up, Cians down, or the reverse. Deep red schist, tunnels cut straight through the rock. The best-kept secret of the region.",
      "km": 290,
      "van": 0,
      "hours": 6,
      "stops": [
        {
          "name": "Castellane",
          "lat": 43.847,
          "lon": 6.513
        },
        {
          "name": "Entrevaux",
          "lat": 43.948,
          "lon": 6.812
        },
        {
          "name": "Gorges de Daluis",
          "lat": 44.058,
          "lon": 6.827
        },
        {
          "name": "Guillaumes",
          "lat": 44.093,
          "lon": 6.851
        },
        {
          "name": "Beuil",
          "lat": 44.093,
          "lon": 6.995
        },
        {
          "name": "Gorges du Cians",
          "lat": 44.01,
          "lon": 7.005
        },
        {
          "name": "Touët-sur-Var",
          "lat": 43.958,
          "lon": 6.995
        },
        {
          "name": "Puget-Théniers",
          "lat": 43.955,
          "lon": 6.895
        },
        {
          "name": "Castellane",
          "lat": 43.847,
          "lon": 6.513
        }
      ]
    },
    {
      "n": 7,
      "date": "Sun 13 Sep",
      "type": "van",
      "title": "Castellane → Cassis",
      "base": "Base 3 · Cassis · nights 7–8",
      "detail": "~190 km south-west to the coast. Once the tent is up, ride the Route des Crêtes over Cap Canaille — the highest sea cliffs in France, and about 20 minutes from camp.",
      "km": 90,
      "van": 190,
      "hours": 2,
      "stops": [
        {
          "name": "Cassis",
          "lat": 43.215,
          "lon": 5.539
        },
        {
          "name": "Cap Canaille",
          "lat": 43.19,
          "lon": 5.56
        },
        {
          "name": "Route des Crêtes",
          "lat": 43.183,
          "lon": 5.583
        },
        {
          "name": "La Ciotat",
          "lat": 43.175,
          "lon": 5.605
        },
        {
          "name": "Cassis",
          "lat": 43.215,
          "lon": 5.539
        }
      ]
    },
    {
      "n": 8,
      "date": "Mon 14 Sep",
      "type": "ride",
      "title": "Sainte-Baume & the Var coast",
      "base": "Base 3 · Cassis",
      "detail": "Inland over the Sainte-Baume massif, down the Gorges d'Ollioules, then the coast road through Bandol, Sanary and Six-Fours. Note the Calanques themselves are closed to vehicles — they are a walk, not a ride.",
      "km": 230,
      "van": 0,
      "hours": 5,
      "stops": [
        {
          "name": "Cassis",
          "lat": 43.215,
          "lon": 5.539
        },
        {
          "name": "Aubagne",
          "lat": 43.293,
          "lon": 5.57
        },
        {
          "name": "Plan-d'Aups",
          "lat": 43.335,
          "lon": 5.727
        },
        {
          "name": "Signes",
          "lat": 43.288,
          "lon": 5.868
        },
        {
          "name": "Ollioules",
          "lat": 43.14,
          "lon": 5.848
        },
        {
          "name": "Sanary-sur-Mer",
          "lat": 43.12,
          "lon": 5.8
        },
        {
          "name": "Bandol",
          "lat": 43.135,
          "lon": 5.753
        },
        {
          "name": "Cassis",
          "lat": 43.215,
          "lon": 5.539
        }
      ]
    },
    {
      "n": 9,
      "date": "Tue 15 Sep",
      "type": "van",
      "title": "Cassis → Luberon",
      "base": "Base 4 · Luberon · nights 9–10",
      "detail": "~130 km north to Bonnieux or Apt. Afternoon loop through the perched villages: Lourmarin, Ménerbes, Gordes, Roussillon.",
      "km": 110,
      "van": 130,
      "hours": 2.5,